App,Phrase,Autor,Song
musicas,"You better lose yourself in the music, the moment. - Eminem - Lose Yourself",,
bomdia,"Que sua vida seja guiada pela paz.",,
biblicos,"Habite ricamente em vocês a palavra de Cristo; ensinem e aconselhem-se uns aos outros com toda a sabedoria e cantem salmos, hinos e cânticos espirituais com gratidão a Deus em seu coração. - Colossenses 3:16",,
motivacionais,"Dar qualquer coisa menos que o seu melhor é sacrificar o seu dom. - Steve Prefontaine",,
tarde,"Que cada pensamento seja repleto de ternura.",,
aniversarios,"Tenho muito orgulho de ver a pessoa linda que se torna a cada ano que passa. Sou a pessoa que mais torce pelo seu sucesso e pela sua felicidade. Te amo!",,