App,Phrase,Autor,Song
bomdia,"Inspire gratidão e colha inspiração em dobro.",,
biblicos,"Que Deus lhe conceda do céu o orvalho e da terra a riqueza, com muito cereal e muito vinho. Que as nações o sirvam e os povos se curvem diante de você. Seja senhor dos seus irmãos, e curvem-se diante de você os filhos de sua mãe. Malditos sejam os que o amaldiçoarem e benditos sejam os que o abençoarem"". - Gênesis 27:28-29",,
motivacionais,"Quanto mais fortes forem suas provações, maiores serão suas vitórias.",,
tarde,"Que sua tarde seja iluminada por serenidade.",,
musicas,"Meu riso é tão feliz contigo - Tribalistas - Velha Infância",,
aniversarios,"Parabéns e muito amor é o que desejo para você!",,