App,Phrase,Autor,Song
bomdia,"Gratidão a Deus muda qualquer cenário.",,
motivacionais,"Quando eu deixar de ser o que sou, eu irei me tornar o que poderia ser - Lao Tzu",,
biblicos,"Mil poderão cair ao seu lado; dez mil, à sua direita, mas nada o atingirá. - Salmos 91:7",,
aniversarios,"🎈 Feliz aniversário! Paz, amor, saúde e esperança é o que desejo para você neste lindo dia. 🎉",,
tarde,"Que Deus ilumine cada passo do seu caminho.",,
musicas,"As pessoas não são más, elas só estão perdidas - Criolo - Ainda Há Tempo",,