App,Phrase,Autor,Song
biblicos,"O Senhor o susterá em seu leito de enfermidade, e da doença o restaurará. - Salmos 41:3",,
motivacionais,"Meu sucesso se deve ao fato de me cercar de pessoas competentes - Enzo Ferrari",,
tarde,"Você é capaz de superar todos os desafios hoje.",,
musicas,"Honey, I’d walk through fire for you. Just let me adore you - Harry Styles - Adore You",,
aniversarios,"Um balde de amor e uma chuva de felicidade é o que mais desejo para você hoje! Parabéns!",,
bomdia,"Cada manhã é presente do Criador.",,