App,Phrase,Autor,Song
bomdia,"Confie em Deus e siga confiante.",,
biblicos,"Senhor, meu Deus, em ti me refugio; salva-me e livra-me de todos os que me perseguem, - Salmos 7:1",,
motivacionais,"Aquele que cometeu um erro e não corrigiu está cometendo outro erro - Confúcio",,
tarde,"Ternura é força suave que aquece os dias.",,
musicas,"Porque metade de mim é o que eu grito, mas a outra metade é silêncio. - Oswaldo Montenegro - Metade",,
aniversarios,"Que a vida lhe traga muitas alegrias, saúde e momentos especiais. Feliz aniversário! 🌟",,