App,Phrase,Autor,Song
musicas,"A preguiça é inimiga da vitória, o fraco não tem espaço e o covarde morre sem tentar - Racionais MC’s - Sou Mais Você",,
bomdia,"Deus tem sempre o melhor caminho.",,
biblicos,"porque, se o fizerem e eles clamarem a mim, eu certamente atenderei ao seu clamor. - Êxodo 22:23",,
motivacionais,"O verdadeiro homem mede a sua força quando se defronta com o obstáculo. - Antoine de Saint-Exupéry",,
tarde,"Que sua vida esteja sempre nas mãos de Deus.",,
aniversarios,"Feliz aniversário! Viver é uma dádiva! Por isso celebre, ame, perdoe e seja feliz. Afinal, é isso que importa nessa vida! 🎉",,