App,Phrase,Autor,Song
biblicos,"Acima de tudo, porém, revistam-se do amor, que é o elo perfeito. - Colossenses 3:14",,
motivacionais,"Aquele que domina os outros é forte; aquele que domina a si mesmo é todo-poderoso - Lao Tsu",,
tarde,"Que sua fé renove suas forças nesta tarde.",,
musicas,"Que não seja imortal, posto que é chama, mas que seja infinito enquanto dure - Vinicius de Moraes - Soneto de Fidelidade",,
aniversarios,"Você é força, luz e alegria. Muitas felicidades e muito amor sempre!",,
bomdia,"O esforço de hoje gera orgulho amanhã.",,