App,Phrase,Autor,Song
bomdia,"Entregue sua ansiedade a Deus, Ele cuida.",,
biblicos,"Combati o bom combate, terminei a corrida, guardei a fé. - 2 Timóteo 4:7",,
motivacionais,"Só se pode alcançar um grande êxito quando nos mantemos fiéis a nós mesmos. - Friedrich Nietzsche",,
tarde,"Que a graça do Senhor renove suas esperanças.",,
musicas,"Antes de eu respirar, sopraste Tua vida em mim, Tu tens sido tão, tão bom pra mim. - Isaías Saad - Ousado Amor",,
aniversarios,"Parabéns a você, que fica mais jovem e radiante a cada ano que passa! 🎁🥳",,
animes,"Garanto a você, L é real. Eu existo. Agora, tente me matar! - L. Lawliet",,