App,Phrase,Autor,Song
bomdia,"Louve a cada bênção recebida de Deus.",,
motivacionais,"Você nunca vai chegar ao seu destino se você parar e atirar pedras em cada cão que late - Winston Churchill",,
tarde,"Com Deus ao lado, tudo se torna possível.",,
musicas,"O som da tua voz é pra mim um céu que não tem fim - Maneva - Vem Ver",,
aniversarios,"Você é a minha maior inspiração todos os dias. Parabéns, maninho!",,
biblicos,"Mas o Senhor é fiel; ele os fortalecerá e os guardará do Maligno. - 2 Tessalonicenses 3:3",,