App,Phrase,Autor,Song
bomdia,"Sua determinação inspira sua própria vitória.",,
biblicos,"Quem tem muitos amigos pode chegar à ruína, mas existe amigo mais apegado que um irmão. - Provérbios 18:24",,
motivacionais,"Tudo tem beleza. Mas nem todos podem ver - Confúcio",,
tarde,"Que cada oração seja resposta de esperança.",,
musicas,"I’m taking my new salvation and I’ma build my own foundation, yeah - Beyoncé - BREAK MY SOUL",,
aniversarios,"Que hoje seja um dia de renovação e o começo de muitos outros sonhos. Feliz aniversário!",,