App,Phrase,Autor,Song
bomdia,"Cada manhã traz uma chance de vencer.",,
biblicos,"E a paz de Deus, que excede todo o entendimento, guardará o coração e a mente de vocês em Cristo Jesus. - Filipenses 4:7",,
motivacionais,"Os desafios são o que tornam a vida interessante, e superá-los é o que torna a vida significativa.",,
tarde,"Que sua tarde seja conduzida pela fé.",,
musicas,"Se o que eu sou é também o que eu escolhi ser, aceito a condição - Los Hermanos - O Velho e o Moço",,
aniversarios,"Hoje é dia de agradecer a Deus pela sua vida, sua saúde e sua jornada até aqui. Espero que Ele continue iluminando o seu caminho. Felicidades!",,