App,Phrase,Autor,Song
bomdia,"Cada manhã traz uma chance de vencer.",,
biblicos,"Da mesma forma o Espírito nos ajuda em nossa fraqueza, pois não sabemos como orar, mas o próprio Espírito intercede por nós com gemidos inexprimíveis. E aquele que sonda os corações conhece a intenção do Espírito, porque o Espírito intercede pelos santos de acordo com a vontade de Deus. - Romanos 8:26-27",,
motivacionais,"Quando você contrata pessoas mais inteligentes do que você, prova que é mais inteligente do que elas - R. H. Grant",,
tarde,"Que sua tarde seja conduzida pela fé.",,
musicas,"Se o que eu sou é também o que eu escolhi ser, aceito a condição - Los Hermanos - O Velho e o Moço",,
aniversarios,"Hoje é dia de agradecer a Deus pela sua vida, sua saúde e sua jornada até aqui. Espero que Ele continue iluminando o seu caminho. Felicidades!",,