App,Phrase,Autor,Song
bomdia,"Que seu coração seja aquecido por amor hoje.",,
biblicos,"Sabemos que Deus age em todas as coisas para o bem daqueles que o amam, dos que foram chamados de acordo com o seu propósito. - Romanos 8:28",,
motivacionais,"A vitória sempre foi de quem nunca duvidou dela - Raul Follerean",,
tarde,"Não desanime, o caminho do sucesso exige paciência.",,
musicas,"Você é invencível, do tamanho do seu sonho, você vai chegar - MC Daniel (part. MC Hariel) - Invencível",,
aniversarios,"Que hoje seja um dia de renovação e o começo de muitos outros sonhos. Feliz aniversário!",,