App,Phrase,Autor,Song
bomdia,"Seja inspiração mesmo nos dias difíceis.",,
biblicos,"""Venham a mim, todos os que estão cansados e sobrecarregados, e eu darei descanso a vocês. - Mateus 11:28",,
motivacionais,"Depois de tantas batalhas, você também merece alguns dias de trégua com o seu corpo.",,
tarde,"Com Deus, até os dias difíceis se tornam leves.",,
musicas,"Dessa vez eu acho que é melhor eu ir, mas antes de tudo, desejo boa sorte - KayBlack - Melhor Só",,
aniversarios,"Que nunca lhe falte motivos para sorrir e que este novo ano que se inicia seja repleto de conquistas e vitórias.",,