App,Phrase,Autor,Song
bomdia,"Inspire confiança no poder dos seus sonhos.",,
biblicos,"Perfume e incenso trazem alegria ao coração; do conselho sincero do homem nasce uma bela amizade. Não abandone o seu amigo nem o amigo de seu pai; quando for atingido pela adversidade não vá para a casa de seu irmão; melhor é o vizinho próximo do que o irmão distante. - Provérbios 27:9-10",,
motivacionais,"Ser grande não é uma questão de tamanho, é uma questão de atitude.",,
tarde,"Não desanime, o caminho do sucesso exige paciência.",,
musicas,"Você é invencível, do tamanho do seu sonho, você vai chegar - MC Daniel (part. MC Hariel) - Invencível",,
aniversarios,"Que hoje seja um dia de renovação e o começo de muitos outros sonhos. Feliz aniversário!",,