App,Phrase,Autor,Song
bomdia,"Deus já cuidou de todos os detalhes.",,
biblicos,"Ofereça a Deus em sacrifício a sua gratidão, cumpra os seus votos para com o Altíssimo - Efésios 5:20",,
motivacionais,"Todas as famílias felizes se parecem, cada família infeliz é infeliz à sua maneira. - Leon Tolstói",,
tarde,"Deus é abrigo, fortaleza e fonte de paz.",,
musicas,"E quem quer saber? A vida é tão rara - Lenine - Paciência",,
aniversarios,"Que o seu aniversário seja o início de um ano incrível, repleto de boas surpresas e sucesso. Parabéns! 🎁",,