App,Phrase,Autor,Song
bomdia,"Compartilhe sorrisos e espalhe inspiração.",,
biblicos,"Ora, a fé é a certeza daquilo que esperamos e a prova das coisas que não vemos. - Hebreus 11:1",,
motivacionais,"Não existe nada de completamente errado no mundo. Mesmo um relógio parado consegue estar certo duas vezes por dia. - Paulo Coelho",,
tarde,"Seu esforço nunca será em vão, confie no processo.",,
musicas,"Enquanto você se esforça pra ser um sujeito normal e fazer tudo igual, eu, do meu lado, aprendendo a ser louco, um maluco total - Raul Seixas - Maluco Beleza",,
aniversarios,"Parabéns, saúde e paz plena. 🎈🎉🥳 Feliz aniversário! Deus abençoe sempre sua vida e família. 🎉",,