App,Phrase,Autor,Song
biblicos,"Visto que você é precioso e honrado à minha vista, e porque eu o amo, darei homens em seu lugar, e nações em troca de sua vida. - Isaías 43:4",,
motivacionais,"Talento é dom, é graça. E sucesso nada tem a ver com sorte, mas com determinação e trabalho. - Augusto Branco",,
tarde,"Receba meu carinho sincero nesta linda tarde.",,
musicas,"Hoje eu acordei feliz, sonhei com ela a noite inteira, eu sempre quis - Charlie Brown Jr. - Hoje Eu Acordei Feliz",,
aniversarios,"Você é um presente de Deus! Parabéns pelo seu aniversário e muito sucesso para este próximo ano. 💝",,
bomdia,"A presença de Deus traz paz verdadeira.",,