App,Phrase,Autor,Song
bomdia,"Louve a cada bênção recebida de Deus.",,
motivacionais,"Você nunca vai chegar ao seu destino se você parar e atirar pedras em cada cão que late - Winston Churchill",,
tarde,"Com Deus ao lado, tudo se torna possível.",,
musicas,"Pra poder viver o amor tem primeiro que se amar - 5 a seco - Ventos de Netuno",,
aniversarios,"Celebrar a sua vida será sempre um dos maiores motivos para me fazer sorrir. Parabéns, irmão!",,
biblicos,"Mas o Senhor é fiel; ele os fortalecerá e os guardará do Maligno. - 2 Tessalonicenses 3:3",,