App,Phrase,Autor,Song
musicas,"E não mudo minha postura só para te agradar - Ana Carolina - Garganta",,
bomdia,"Você é motivo de carinho e alegria.",,
biblicos,"pois é Deus quem efetua em vocês tanto o querer quanto o realizar, de acordo com a boa vontade dele. - Filipenses 2:13",,
motivacionais,"Jiu Jitsu é como uma filosofia. Me ajuda a aprender como encarar a vida. - Hélio Gracie",,
tarde,"Lembre-se, cada esforço fortalece sua caminhada vitoriosa.",,
aniversarios,"Que o seu dia seja marcado pela alegria!",,