App,Phrase,Autor,Song
biblicos,"Estou quase desfalecido, aguardando a tua salvação, mas na tua palavra depositei a minha esperança. - Salmos 119:81",,
motivacionais,"As mentes mais poderosas têm objetivos, as demais, têm desejos.",,
musicas,"Vamos acordar, hoje tem um Sol diferente no céu, gargalhando no seu carrossel, gritando: nada é tão triste assim! - Paulinho Moska - Tudo Novo de Novo",,
aniversarios,"Que o seu dia seja leve como um balão e doce como um brigadeiro! Parabéns, irmão!",,
bomdia,"Seu abraço é o melhor lugar do mundo.",,
tarde,"Pequenas vitórias também te levam ao grande sucesso.",,