App,Phrase,Autor,Song
bomdia,"O hoje é o primeiro passo do amanhã.",,
biblicos,"De manhã ouves, Senhor, o meu clamor; de manhã te apresento a minha oração e aguardo com esperança. - Salmos 5:3",,
motivacionais,"Não arriscar nada é arriscar tudo - Cesare Cant",,
tarde,"Com Deus, até os dias difíceis se tornam leves.",,
musicas,"Sou minha, só minha, e não de quem quiser - Legião Urbana - 1º de Julho",,
aniversarios,"Todo dia é uma nova oportunidade que a vida oferece a quem nela crê. Feliz aniversário!",,