App,Phrase,Autor,Song
bomdia,"Que sua vida seja envolta em carinho.",,
biblicos,"""Ao vencedor darei o direito de sentar-se comigo em meu trono, assim como eu também venci e sentei-me com meu Pai em seu trono. - Apocalipse 3:21",,
motivacionais,"Trabalhe duro em silêncio. Deixe que o sucesso faça barulho.",,
tarde,"Que seu coração esteja rodeado de bondade.",,
musicas,"Tu és o motivo, Jesus, que eu tenho pra avançar - Jessé Aguiar - Alívio",,
aniversarios,"Te desejo muitos anos de vida, e que todos eles sejam ao meu lado. Amo você! ❤️",,