App,Phrase,Autor,Song
biblicos,"Quem se nega a castigar seu filho não o ama; quem o ama não hesita em discipliná-lo. - Provérbios 13:24",,
motivacionais,"Neste mundo, há apenas duas tragédias: uma a de não satisfazermos os nossos desejos, e a outra a de os satisfazermos. - Oscar Wilde",,
tarde,"Que sua vida seja sempre tocada por ternura.",,
musicas,"‘Cause there will be no sunlight if I lose you, baby - Bruno Mars - It Will Rain",,
aniversarios,"Irmã, você é como uma estrela que ilumina a minha vida mesmo de longe. Parabéns!",,
bomdia,"Que nunca falte afeto ao seu redor.",,