App,Phrase,Autor,Song
bomdia,"Sua determinação inspira sua própria vitória.",,
biblicos,"Quem tem muitos amigos pode chegar à ruína, mas existe amigo mais apegado que um irmão. - Provérbios 18:24",,
motivacionais,"Tudo tem beleza. Mas nem todos podem ver - Confúcio",,
tarde,"Que cada oração seja resposta de esperança.",,
musicas,"Basta ser sincero e desejar profundo, você será capaz de sacudir o mundo - Raul Seixas - Tente Outra Vez",,
aniversarios,"Sua determinação e coragem são inspiradoras, e eu tenho certeza de que este ano será de realizações incríveis. 🌟 Te amo além das palavras! ❤️",,