App,Phrase,Autor,Song
bomdia,"Tente ser produtivo. Ou só tente, já é um começo.",,
biblicos,"Bendito seja o Deus e Pai de nosso Senhor Jesus Cristo, Pai das misericórdias e Deus de toda consolação, que nos consola em todas as nossas tribulações, para que, com a consolação que recebemos de Deus, possamos consolar os que estão passando por tribulações. - 2 Coríntios 1:3-4",,
motivacionais,"A felicidade não é algo pronto. Ela vem de suas próprias ações - Dalai Lama",,
tarde,"Hoje é o momento certo para recomeçar e vencer.",,
musicas,"Um xodó pra mim do meu jeito assim, que alegre o meu viver - Dominguinhos - Eu Só Quero Um Xodó",,
aniversarios,"Peço a Deus todos os dias para te proteger e te guardar. Que você continue sempre essa menina alegre e estudiosa,",,