App,Phrase,Autor,Song
bomdia,"Inspire-se e seja inspiração para os outros.",,
biblicos,"Todos os seus filhos serão ensinados pelo Senhor, e grande será a paz de suas crianças. - Isaías 54:13",,
motivacionais,"O sucesso de cada mulher deveria ser uma inspiração para outra mulher. Somos mais fortes quando nos apoiamos. - Serena Williams",,
tarde,"Afeto é a poesia que o coração entende.",,
musicas,"I say the darker the flesh, then the deeper the roots. - 2Pac - Keep Ya Head Up",,
aniversarios,"Seu sorriso é fonte de luz nesse mundo, então espero que você sorria muito hoje e saiba o quanto é especial e importante para mim.",,