App,Phrase,Autor,Song
bomdia,"Transforme cada dificuldade em aprendizado valioso.",,
biblicos,"Mas eu, quando estiver com medo, confiarei em ti. - Salmos 56:3",,
motivacionais,"Muita coisa que ontem parecia importante ou significativa amanhã virará pó no filtro da memória. Mas o sorriso (...) ah, esse resistirá a todas as ciladas do tempo. - Caio Fernando Abreu",,
tarde,"Que sua tarde seja macia como um abraço.",,
musicas,"Se todos fossem iguais a você, que maravilha viver - Tom Jobim - Se Todos Fossem Iguais a Você",,
aniversarios,"Te amo muito! Parabéns pelo seu dia, meu irmão lindo!",,