App,Phrase,Autor,Song
bomdia,"Continue firme, os resultados estão chegando.",,
biblicos,"Mas o Senhor é fiel; ele os fortalecerá e os guardará do Maligno. - 2 Tessalonicenses 3:3",,
motivacionais,"Todos os sorrisos do mundo não irão ajudá-lo se o produto ou serviço não for o que o cliente deseja - Carl Sewell",,
tarde,"Confie, Deus prepara sempre o melhor caminho.",,
musicas,"Sou caboclo do sertão, só tenho amor no coração pra oferecer - Mastruz Com Leite - Onde Canta o Sabiá",,
aniversarios,"Meu irmão, meu grande presente de Deus. Parabéns pelo seu dia e muitas felicidades sempre!",,