App,Phrase,Autor,Song
musicas,"Pra te ver sorrir, eu posso colorir o céu de outra cor - Pollo (part. Ivo Mozart) - Vagalumes",,
bomdia,"Que sua vida seja guiada pela paz.",,
biblicos,"Habite ricamente em vocês a palavra de Cristo; ensinem e aconselhem-se uns aos outros com toda a sabedoria e cantem salmos, hinos e cânticos espirituais com gratidão a Deus em seu coração. - Colossenses 3:16",,
motivacionais,"Se o plano não funciona, mude o plano, não a meta.",,
tarde,"Que sua energia esteja em plena harmonia.",,
aniversarios,"Um feliz aniversário repleto de risadas, muito bolo e muita comemoração. Muitas felicidades!",,