App,Phrase,Autor,Song
musicas,"I had a dream I got everything I wanted - Billie Eilish - everything i wanted",,
bomdia,"Cada desafio é uma oportunidade de crescer.",,
biblicos,"Como um pai tem compaixão de seus filhos, assim o Senhor tem compaixão dos que o temem; - Salmos 103:13",,
motivacionais,"É preciso ter dúvidas. Só os estúpidos têm uma confiança absoluta em si mesmos - Orson Welles",,
tarde,"A vida recompensa quem não desiste dos sonhos.",,
aniversarios,"Você é o lembrete perfeito de porquê o mundo é tão maravilhoso. Obrigado por trazer luz às nossas vidas!",,