App,Phrase,Autor,Song
bomdia,"A inspiração nasce no silêncio da alma.",,
biblicos,"Tomando os cinco pães e os dois peixes e, olhando para o céu, deu graças e partiu os pães. Em seguida, entregou-os aos seus discípulos para que os servissem ao povo. E também dividiu os dois peixes entre todos eles. Todos comeram e ficaram satisfeitos, e os discípulos recolheram doze cestos cheios de pedaços de pão e de peixe. - Marcos 6:41-43",,
motivacionais,"Uma boa cabeça e um bom coração formam sempre uma combinação formidável - Nelson Mandela",,
tarde,"Que sua mente repouse na serenidade do agora.",,
musicas,"Eu sei que a vida devia ser bem melhor, e será! - Gonzaguinha - O Que É, O Que É?",,
aniversarios,"Parabéns! Mais do que desejar felicidades, eu desejo transformação, coragem e recomeços verdadeiros.",,