App,Phrase,Autor,Song
bomdia,"Cada recomeço é uma nova chance.",,
biblicos,"O que as suas mãos tiverem que fazer, que o façam com toda a sua força, pois na sepultura, para onde você vai, não há atividade nem planejamento, não há conhecimento nem sabedoria. - Eclesiastes 9:10",,
motivacionais,"Você é mais forte do que imagina, mais capaz do que pensa e mais valioso do que acredita.",,
tarde,"Que a paz seja sua melhor companhia.",,
musicas,"Quem samba na beira do mar é sereia - Clara Nunes - O Mar Serenou",,
aniversarios,"O aniversário é seu, mas, se eu puder fazer um pedido, desejo que você fique na minha vida para sempre. Te amo muito! ❤️",,