App,Phrase,Autor,Song
bomdia,"Você é mais forte do que imagina.",,
biblicos,"O Senhor é a minha luz e a minha salvação; de quem terei temor? O Senhor é o meu forte refúgio; de quem terei medo? - Salmos 27:1",,
motivacionais,"Aqueles que nada fazem estão sempre dispostos a criticar os que fazem algo - Paul Deschanel",,
tarde,"Que sua vida floresça com amor e carinho.",,
musicas,"Se eu tô com a tropa, me sinto intocável, nós sempre protege o outro - Major RD - 60K",,
aniversarios,"Que esse novo ciclo seja um tempo de recomeço e evolução na sua vida. Parabéns, amiga querida!",,