App,Phrase,Autor,Song
bomdia,"A inspiração nasce no silêncio da alma.",,
biblicos,"Pois a sua ira só dura um instante, mas o seu favor dura a vida toda; o choro pode persistir uma noite, mas de manhã irrompe a alegria. - Salmos 30:5",,
motivacionais,"O esforço de hoje é o resultado visível de amanhã.",,
tarde,"O carinho sincero fortalece até os dias nublados.",,
musicas,"Tens o dom de seres muito onde muitos não têm nada. - João Gomes e Nilson Chaves - Sabor Açaí",,
aniversarios,"Parabéns pelo seu dia! Que este ano que se inicia seja repleto de renovação interior, amor em abundância, saúde de ferro e sonhos realizados. Você merece toda a felicidade!",,