App,Phrase,Autor,Song
bomdia,"Que o afeto ilumine cada instante seu.",,
biblicos,"Nem muitas águas conseguem apagar o amor; os rios não conseguem levá-lo na correnteza. Se alguém oferecesse todas as riquezas da sua casa para adquirir o amor, seria totalmente desprezado. - Cânticos 8:7",,
motivacionais,"Sente-se sufocado aquele sem um objetivo de vida - Fiódor Dostoiévski",,
tarde,"Que sua tarde seja cheia de gestos doces.",,
aniversarios,"Que nunca lhe faltem motivos para sorrir e que este novo ano que se inicia seja repleto de conquistas e vitórias. Felicidades, hoje e sempre!",,