App,Phrase,Autor,Song
bomdia,"Quem persiste sempre encontra o caminho.",,
biblicos,"Provem e vejam como o Senhor é bom. Como é feliz o homem que nele se refugia! - Salmos 34:8",,
motivacionais,"Nada acontece a menos que sonhemos antes - Carl Sandburg",,
tarde,"Você é capaz de superar todos os desafios hoje.",,
musicas,"A esperança, equilibrista, sabe que o show de todo banda tem que continuar - Elis Regina - O Bêbado e o Equilibrista",,
aniversarios,"Um feliz aniversário e uma vida de muita alegria é o que desejarei sempre para você!",,