App,Phrase,Autor,Song
bomdia,"Você merece todo cuidado e carinho do mundo.",,
biblicos,"A mulher exemplar é a coroa do seu marido, mas a de comportamento vergonhoso é como câncer em seus ossos. - Provérbios 12:4",,
motivacionais,"Ninguém pode construir uma reputação com base naquilo que ainda vai fazer - Henry Ford",,
tarde,"Receba todo meu afeto em forma de palavras.",,
musicas,"Se eu tivesse que ter duas, uma seria você - Dilsinho - Duas",,
aniversarios,"Tudo o que você faz é com muito empenho. Parabéns por ser tão esforçado e querido com todos. Feliz aniversário.",,