App,Phrase,Autor,Song
bomdia,"Que sua alma descanse na paz de hoje.",,
biblicos,"Pois assim como os sofrimentos de Cristo transbordam sobre nós, também por meio de Cristo transborda a nossa consolação. - 2 Coríntios 1:5",,
motivacionais,"O seu ""eu"" do futuro vai ser tão grato pelo esforço que você faz nos treinos do presente.",,
tarde,"Entregue seus pensamentos a Deus e sinta a paz.",,
musicas,"Antes de eu respirar, sopraste Tua vida em mim, Tu tens sido tão, tão bom pra mim. - Isaías Saad - Ousado Amor",,
aniversarios,"Parabéns, meu amor ❤️. Que possamos continuar compartilhando risadas, aventuras e descobertas.",,