App,Phrase,Autor,Song
bomdia,"Compartilhe sorrisos e espalhe inspiração.",,
biblicos,"Eu dei a vocês autoridade para pisarem sobre cobras e escorpiões, e sobre todo o poder do inimigo; nada lhes fará dano. - Lucas 10:19",,
motivacionais,"O pior erro que você pode cometer em sua vida é ficar com medo de cometer algum erro - Elbert Hubbard",,
tarde,"Ternura é força suave que aquece os dias.",,
musicas,"Porque metade de mim é o que eu grito, mas a outra metade é silêncio. - Oswaldo Montenegro - Metade",,
aniversarios,"Que não falte empenho para seguir sempre além. Saúde e força! Parabéns!",,