App,Phrase,Autor,Song
musicas,"I had a dream I got everything I wanted - Billie Eilish - everything i wanted",,
bomdia,"Deus nunca falha, Ele sempre provê.",,
biblicos,"Protege-me, ó Deus, pois em ti me refugio. - Salmos 16:1",,
motivacionais,"Com o passar dos anos, depois de muitos ferimentos e doenças, percebi que o jiu-jítsu é muito mais do que lutar; é uma metáfora para a vida. - Rickson Gracie",,
tarde,"Que cada oração sua chegue ao coração de Deus.",,
aniversarios,"Espero que o seu dia especial lhe traga tudo o que seu coração deseja! Tenha um dia cheio de surpresas maravilhosas! Feliz aniversário!",,