App,Phrase,Autor,Song
bomdia,"Respire fundo, sorria e sinta tranquilidade.",,
biblicos,"Por isso, exortem-se e edifiquem-se uns aos outros, como de fato vocês estão fazendo. - 1 Tessalonicenses 5:11",,
motivacionais,"Os desafios são o que tornam a vida interessante, e superá-los é o que torna a vida significativa.",,
tarde,"A paz interior é farol em tempos incertos.",,
musicas,"Quem me vê sempre parado, distante, garante que eu não sei sambar. Tô me guardando pra quando o carnaval chegar - Chico Buarque - Quando o Carnaval Chegar",,
aniversarios,"Que Deus te guie e proteja em todos os momentos, enchendo seus dias de paz e felicidade. Feliz aniversário!",,