App,Phrase,Autor,Song
bomdia,"Silencie a mente e escute a paz interior.",,
biblicos,"O Senhor é bom, um refúgio em tempos de angústia. Ele protege os que nele confiam, - Naum 1:7",,
motivacionais,"Uma jornada de mil quilômetros começa pelo primeiro passo - Lao Tsu",,
musicas,"A saudade é o revés de um parto, a saudade é arrumar o quarto do filho que já morreu. - Chico Buarque - Pedaço de Mim",,
aniversarios,"Que o seu dia seja tão especial quanto você é para mim. Parabéns amor!",,
tarde,"Não pare até se orgulhar do que conquistou.",,