App,Phrase,Autor,Song
bomdia,"Paz é a força suave que transforma.",,
biblicos,"Muitas são as dores dos ímpios, mas a bondade do Senhor protege quem nele confia. - Salmos 32:10",,
motivacionais,"Nenhuma empresa pode ter sucesso tentando tudo para todos - Michael Treacy",,
tarde,"Que sua energia seja leve como o vento.",,
musicas,"Bom dia, o sol brilha na minha janela hoje e eu pensando “e se esse dia fosse diferente, menos cinza, tipo, mais cores” - 3030 - Bom Dia",,
aniversarios,"Parabéns, meu amigo, hoje é o seu dia. Muitos anos de vida, paz e amor.",,