App,Phrase,Autor,Song
bomdia,"Que sua alma descanse na paz de hoje.",,
biblicos,"Pois assim como os sofrimentos de Cristo transbordam sobre nós, também por meio de Cristo transborda a nossa consolação. - 2 Coríntios 1:5",,
motivacionais,"Não existe nada de completamente errado no mundo. Mesmo um relógio parado consegue estar certo duas vezes por dia. - Paulo Coelho",,
tarde,"Seu esforço nunca será em vão, confie no processo.",,
musicas,"Enquanto você se esforça pra ser um sujeito normal e fazer tudo igual, eu, do meu lado, aprendendo a ser louco, um maluco total - Raul Seixas - Maluco Beleza",,
aniversarios,"Parabéns, saúde e paz plena. 🎈🎉🥳 Feliz aniversário! Deus abençoe sempre sua vida e família. 🎉",,